{
  "$schema": "./_schema.json",
  "id": "encounter_banish",
  "display_name_key": "SKILL_ENCOUNTER_BANISH_NAME",
  "description_key": "SKILL_ENCOUNTER_BANISH_DESC",
  "description": "Encounter: Banish target. If target has equal or fewer needs.",
  "icon_path": "",

  "owner_types": ["guest"],
  "trigger_type": "on_encounter",

  "conditions": [
    {
      "type": "compare_needs",
      "target": "target",
      "compare_to": "source",
      "comparison": "less_or_equal"
    }
  ],

  "effects": [
    {
      "type": "banish",
      "target": "target"
    }
  ]
}
