{
  "$schema": "./_schema.json",
  "id": "restock_on_deplete",
  "display_name_key": "SKILL_RESTOCK_ON_DEPLETE_NAME",
  "description_key": "SKILL_RESTOCK_ON_DEPLETE_DESC",
  "description": "Serve: Restock stall. If stock is empty.",

  "owner_types": ["guest"],
  "trigger_type": "on_serve",

  "parameters": {},

  "conditions": [
    { "type": "stall_stock_check", "comparison": "equal", "value": 0 }
  ],

  "effects": [
    { "type": "restock_stall", "target": "stall" }
  ],

  "tags": ["service", "restock"]
}
