{
  "$schema": "./_schema.json",
  "id": "ox_hour_bell_early_beasts",
  "display_name_key": "SKILL_OX_HOUR_BELL_EARLY_BEASTS_NAME",
  "description_key": "SKILL_OX_HOUR_BELL_EARLY_BEASTS_DESC",
  "owner_types": ["relic"],
  "trigger_type": "on_level_start",
  "parameters": {},
  "conditions": [],
  "effects": [
    { "type": "enable_early_beast_spawning" }
  ],
  "tags": ["beast"]
}
