{
  "$schema": "./_schema.json",
  "id": "spirit_hall_apply_attuned",
  "display_name_key": "SKILL_SPIRIT_HALL_APPLY_ATTUNED_NAME",
  "description_key": "SKILL_SPIRIT_HALL_APPLY_ATTUNED_DESC",
  "description": "Serve: Apply Spirit Attuned.",
  "icon_path": "",

  "owner_types": ["stall"],
  "trigger_type": "on_serve",

  "parameters": {},

  "conditions": [],

  "effects": [
    { "type": "apply_status", "target": "guest", "status_id": "spirit_attuned", "stacks": 1 }
  ],

  "tags": []
}
