{
  "$schema": "./_schema.json",
  "id": "spirit_attuned_block_entry",
  "display_name_key": "SKILL_SPIRIT_ATTUNED_BLOCK_ENTRY_NAME",
  "description_key": "SKILL_SPIRIT_ATTUNED_BLOCK_ENTRY_DESC",
  "description": "Block entry.",
  "icon_path": "",

  "owner_types": ["guest"],
  "trigger_type": "on_pre_enter_stall",

  "parameters": {},

  "conditions": [],

  "effects": [
    { "type": "block_entry" }
  ],

  "tags": ["debuff", "entry_block"]
}
