{
  "$schema": "./_schema.json",
  "id": "moon_shrine_aura",
  "display_name_key": "SKILL_MOON_SHRINE_AURA_NAME",
  "description_key": "SKILL_MOON_SHRINE_AURA_DESC",
  "description": "Aura (1): Apply Moonlit to nearby stalls. After midnight.",
  "trigger_type": "aura",
  "owner_types": ["stall"],
  "global": false,
  "parameters": {
    "range": { "type": "int", "default": 1 },
    "target_type": { "type": "string", "default": "stall" },
    "status_effect_id": { "type": "string", "default": "moonlit_1" },
    "exclude_self": { "type": "bool", "default": true },
    "midnight_only": { "type": "bool", "default": true }
  },
  "conditions": [],
  "effects": []
}
