{
  "$schema": "./_schema.json",
  "id": "closed_block_entry",
  "display_name_key": "SKILL_CLOSED_BLOCK_ENTRY_NAME",
  "description_key": "SKILL_CLOSED_BLOCK_ENTRY_DESC",
  "description": "Block entry.",
  "icon_path": "",

  "owner_types": ["stall"],
  "trigger_type": "on_pre_enter_stall",

  "parameters": {},

  "conditions": [],

  "effects": [
    { "type": "block_entry" }
  ],

  "tags": ["closed"]
}
