{
  "$schema": "./_schema.json",
  "id": "ox_hour_bell_boost_interact",
  "display_name_key": "SKILL_OX_HOUR_BELL_BOOST_INTERACT_NAME",
  "description_key": "SKILL_OX_HOUR_BELL_BOOST_INTERACT_DESC",
  "owner_types": ["relic"],
  "trigger_type": "on_spawn",
  "global": true,
  "parameters": {},
  "conditions": [
    { "type": "guest_flag_check", "flag": "is_mythical_beast", "target": "guest" }
  ],
  "effects": [
    { "type": "modify_need", "target": "guest", "need_type": "interact", "amount": 1 }
  ],
  "tags": ["beast"]
}
